{
  "step_seconds": 6,
  "steps_per_hour": 600,
  "steps_per_phase": 1800,
  "steps_per_day": 14400,
  "phases": [
    {
      "id": "dead_of_night",
      "name": "Dead of Night",
      "order": 0,
      "start_step": 0,
      "end_step_exclusive": 1800
    },
    {
      "id": "black_hours",
      "name": "Black Hours",
      "order": 1,
      "start_step": 1800,
      "end_step_exclusive": 3600
    },
    {
      "id": "first_light",
      "name": "First Light",
      "order": 2,
      "start_step": 3600,
      "end_step_exclusive": 5400
    },
    {
      "id": "high_morning",
      "name": "High Morning",
      "order": 3,
      "start_step": 5400,
      "end_step_exclusive": 7200
    },
    {
      "id": "sun_at_zenith",
      "name": "Sun at Zenith",
      "order": 4,
      "start_step": 7200,
      "end_step_exclusive": 9000
    },
    {
      "id": "fading_light",
      "name": "Fading Light",
      "order": 5,
      "start_step": 9000,
      "end_step_exclusive": 10800
    },
    {
      "id": "gloaming",
      "name": "Gloaming",
      "order": 6,
      "start_step": 10800,
      "end_step_exclusive": 12600
    },
    {
      "id": "nightfall",
      "name": "Nightfall",
      "order": 7,
      "start_step": 12600,
      "end_step_exclusive": 14400
    }
  ]
}
